artist	genres
Sprout	art rock, britpop, chamber pop, dance rock, madchester, melancholia, new romantic, new wave, new wave pop, synthpop, uk post-punk
Stacked Like Pancakes	Ska, brass-rock, rock
Staind	alternative metal, alternative rock, nu metal, pop rock, post-grunge, rap metal, rap rock, rock
The Starting Line	alternative emo, anthem emo, dreamo, emo, pop emo, pop punk, pop rock, screamo
State Champs	alternative emo, anthem emo, deep pop punk, emo, pixie, pop emo, pop punk
Staylefish	reggae rock
Stepdad	metropopolis, shimmer pop
Stephan Jacobs	glitch hop
Stephen Jerzak	alternative pop rock, electropowerpop
Stick to Your Guns	death core, melodic hardcore, melodic metalcore, metalcore, screamo
Still Remains	christian hardcore, christian metal, groove metal, melodic death metal, melodic metalcore, metalcore, screamo
The Stingrays	No data
Story of the Year	alternative metal, christian alternative rock, emo, melodic metalcore, metalcore, nu metal, pop punk, post-grunge, rap metal, rap rock, screamo
The Story So Far	alternative emo, anthem emo, emo, pixie, pop punk, screamo
Strangers You Know	indie poptimism, indie psych-rock, indie rockism
Strawberry Blondes	No data
Stray from the Path	death core, djent, mathcore, melodic metalcore, metalcore, rap metal, screamo
Straylight Run	dreamo, emo, piano rock, pop punk
Street Dogs	melodic hardcore, oi, punk, ska, ska punk, skate punk
Street Drum Corps	Alternative rock, experimental rock, punk revival, industrial
Streetlight Manifesto	comic, pop punk, punk, ska, ska punk, skate punk
Stretch Armstrong	No data
Strike Anywhere	alternative emo, emo, folk punk, melodic hardcore, orgcore, pop punk, punk, rva indie, ska punk, skate punk
Strung Out	melodic hardcore, pop punk, punk, ska punk, skate punk
Stutterfly	screamo
Sublime	alternative rock, funk rock, pop rock
Suburban Legends	ska, ska punk
Sugarcult	emo, pop punk, pop rock, post-grunge, screamo, skate punk
Sugar Ray	alternative metal, alternative rock, funk metal, funk rock, neo mellow, pop christmas, pop punk, pop rock, post-grunge, punk christmas, rock
Suicidal Tendencies	alternative metal, crossover thrash, funk metal, funk rock, groove metal, grunge, hardcore punk, metal, nu metal, punk, rap metal, rap rock, rock, skate punk, speed metal, thrash metal
Suicide Machines	folk punk, hardcore punk, melodic hardcore, orgcore, pop punk, punk, ska, ska punk, skate punk
Suicide Silence	alternative metal, death core, groove metal, melodic metalcore, metalcore, nu metal, pixie, rap metal, screamo
The Suit	No data
Sum 41	alternative metal, nu metal, pop punk, post-grunge, punk, rap rock
The Summer Set	alternative pop rock, emo, neo mellow, piano rock, pixie, pop, pop emo, pop punk, pop rock, post-teen pop, punk christmas, teen pop, viral pop
The Sunstreak	No data
Supe	hard alternative
Super Water Sympathy	Alternative Rock, Shimmer-Pop
Supernova	Pop punk, punk rock
Survive This!	post-screamo
The Swellers	alternative emo, anthem emo, emo, melodic hardcore, pop punk, skate punk
Swingin' Utters	hardcore punk, melodic hardcore, orgcore, power-pop punk, punk, ska punk, skate punk
Switched	alternative metal, groove metal, industrial metal, nu metal, rap metal, rap rock
Sworn In	death core, metalcore, progressive deathcore, screamo
Sydney	deep indie r&b, escape room, hip hop, indie r&b, neo soul, r&b
Sykes	dance pop, pop, post-teen pop, teen pop, viral pop
Sylar	post-screamo, screamo
T. Mills	pop rap
Taking Back Sunday	emo, pop punk, pop rock, post-grunge, screamo
Talib Kweli	alternative hip hop, dirty south rap, east coast hip hop, hardcore hip hop, hip hop, pop rap, rap, southern hip hop
TAT	skate punk
Taylor Thrash	alternative pop rock
Teenage Bottlerocket	folk punk, melodic hardcore, orgcore, pop punk, power-pop punk, punk, ska, ska punk, skate punk
Ten Second Epic	Alternative rock
Terrible Things	pop punk
Terror	indie poptimism, pop, post-teen pop, teen pop
Tess Dunn	No data
Texas in July	christian hardcore, christian metal, death core, melodic metalcore, metalcore, screamo
There For Tomorrow	christian alternative rock, emo, pixie, pop emo, pop punk, screamo
They All Float	No data
Thirty Seconds to Mars	alternative metal, alternative rock, nu metal, pop punk, post-grunge
This Wild Life	alternative emo, anthem emo, pixie, pop emo, pop punk, screamo
Thrice	alternative metal, dreamo, emo, metalcore, nu metal, pop punk, post-grunge, post-hardcore, punk, screamo, skate punk
Throwdown	alternative metal, christian hardcore, groove metal, hardcore, melodic metalcore, metalcore, nu metal, rap metal, rap rock, straight edge
Throw The Fight	hard alternative, post-screamo
Thursday	alternative emo, dreamo, emo, pop punk, post-hardcore, progressive post-hardcore, screamo
Tiger Army	horror punk, psychobilly, punk, rockabilly, ska punk, skate punk
Tillie	indie rockism
Tilt	deep uplifting trance, epicore
Tip the Van	punk ska, ska, ska punk
Title Fight	alternative emo, anthem emo, emo, indie punk, melodic hardcore, pop punk, screamo
To The Wind	anthem emo, deep melodic metalcore
Tomorrow's Bad Seeds	No data
Tonight Alive	candy pop, emo, pixie, pop emo, pop punk, screamo
Tony D'Angelo	No data
Too Close to Touch	anthem emo, pixie, post-screamo, progressive post-hardcore, screamo
Tornado Rider	No data
Total Chaos	austrian hip hop, crossover thrash, crust punk, hardcore punk, oi, punk, skate punk
Trading Bryson	No artist data
Transit	alternative emo, anthem emo, emo, melodic hardcore, pixie, pop emo, pop punk, screamo
Transplants	pop punk, punk, ska, ska punk, skate punk
Trashing Andi	No data
Treaty of Paris	deep pop emo
Treephort	punk ska
Trophy Eyes	alternative emo, anthem emo, deep australian indie, pixie, pop punk
Trust Company	Alternative metal, nu metal, hard rock, post-grunge
T.S.O.L.	crossover thrash, hardcore punk, horror punk, oi, punk, ska punk, skate punk
Tsunami Bomb	melodic hardcore, pop punk, power-pop punk, punk, ska punk, skate punk
Twilight Creeps	No data
Twin Atlantic	alt-indie rock, british alternative rock, pop punk, scottish rock
Twiztid	horrorcore, rap metal, rap rock, redneck
Underoath	christian metal, dreamo, emo, melodic metalcore, metalcore, pop punk, post-hardcore, progressive post-hardcore, screamo
Unlocking The Truth	No data
Unsane	grunge, math rock, mathcore, noise rock, post-doom metal, post-hardcore, post-metal, sludge metal, space rock
The Unseen	hardcore punk, melodic hardcore, oi, punk, ska punk, skate punk
Unwritten Law	emo, pop punk, post-grunge, punk, skate punk
Upon a Burning Body	death core, groove metal, melodic metalcore, metalcore, nu metal, post-screamo, rap metal, screamo
The Urge	funk rock, ska punk
Urinal Mints	No data
The Used	alternative metal, emo, metalcore, nu metal, pixie, pop punk, pop rock, post-grunge, post-hardcore, screamo
Valencia	anthem emo, dreamo, emo, pop emo, pop punk, punk christmas
Valient Thorr	sludge metal, stoner metal, stoner rock
Vampires Everywhere!	Industrial metal, horror punk, gothic rock
The Vandals	crossover thrash, hardcore punk, heavy christmas, melodic hardcore, pop punk, punk, punk christmas, ska, ska punk, skate punk
The Vanished	grunge pop
Vanna	death core, melodic metalcore, metalcore, post-hardcore, progressive post-hardcore, screamo
Vaux	Alternative rock, Post-hardcore
Veara	alternative emo, anthem emo, deep pop punk, pop punk
Veil Of Maya	death core, djent, mathcore, melodic metalcore, metalcore, rap metal, screamo
Vendetta Red	emo, screamo
VersaEmerge	candy pop, pop emo, punk christmas, screamo
The Vincent Black Shadow	steampunk
Vision of Disorder	alternative metal, groove metal, hardcore, industrial metal, mathcore, metalcore, nu metal, rap metal, rap rock
Volumes	death core, djent, metalcore, rap metal, screamo
Vonnegutt	soul flow, underground pop rap
Voodoo Blue	deep pop emo
Wage War	melodic metalcore, metalcore, post-screamo, rap metal, screamo
Waka Flocka Flame	crunk, dirty south rap, dwn trap, gangster rap, hip hop, pop rap, rap, southern hip hop, trap music, underground hip hop
Wallpaper.	deep australian indie, indie dream pop, vapor soul
War on Women	No data
Waterparks	anthem emo, pixie, pop emo, pop punk
Watsky	abstract hip hop, comic, pop rap, underground pop rap
The Waves	new wave pop
Wax	underground pop rap
We Are The In Crowd	candy pop, emo, pixie, pop emo, pop punk
We Are The Ocean	british alternative rock, screamo
We Came As Romans	emo, melodic metalcore, metalcore, pixie, pop punk, post-screamo, rap metal, screamo
We the Kings	emo, neo mellow, piano rock, pixie, pop, pop punk, pop rock, post-teen pop, teen pop, viral pop
weatherPROOF	No data
Weerd Science	abstract hip hop
Weezer	alternative metal, alternative rock, blues-rock, garage rock, indie christmas, indie pop, indie rock, nu metal, permanent wave, pop christmas, pop punk, pop rock, post-grunge, punk christmas, rock
We're Doomed	No genre
West Beverly	No data
While She Sleeps	melodic metalcore, metalcore, rap metal, screamo
Whitechapel	death core, groove metal, melodic metalcore, metalcore, nu metal, rap metal, screamo
White Kaps	No data
The White Noise	Post-hardcore, melodic hardcore, hardcore punk, metalcore
Wick-It The Instigator	mashup
William Control	electropowerpop, steampunk
Wind In Sails	anthem emo
Winds Of Plague	death core, melodic metalcore, metalcore
Windsor Drive	dreamo, piano rock
